07:23:12.267566 IP (tos 0x10, ttl 64, id 41185, offset 0, flags [DF], proto TCP (6), length 60)
    59.233.235.218.39247 > 59.233.235.223.nupaper-ss: Flags [S], cksum 0x8fad (correct), seq 2635601089, win 14600, options [mss 1460,sackOK,TS val 18592800 ecr 0,nop,wscale 7], length 0
07:23:12.267694 IP (tos 0x0, ttl 64, id 0, offset 0, flags [DF], proto TCP (6), length 60)
    59.233.235.223.nupaper-ss > 59.233.235.218.39247: Flags [S.], cksum 0xa988 (correct), seq 3131636289, ack 2635601090, win 14480, options [mss 1460,sackOK,TS val 46280417 ecr 18592800,nop,wscale 5], length 0
07:23:12.267956 IP (tos 0x10, ttl 64, id 41186, offset 0, flags [DF], proto TCP (6), length 52)
    59.233.235.218.39247 > 59.233.235.223.nupaper-ss: Flags [.], cksum 0x1070 (correct), ack 1, win 115, options [nop,nop,TS val 18592800 ecr 46280417], length 0
07:23:12.303574 IP (tos 0x0, ttl 64, id 54435, offset 0, flags [DF], proto TCP (6), length 55)
    59.233.235.223.nupaper-ss > 59.233.235.218.39247: Flags [P.], cksum 0xea0b (correct), seq 1:4, ack 1, win 453, options [nop,nop,TS val 46280426 ecr 18592800], length 3
07:23:12.303821 IP (tos 0x10, ttl 64, id 41187, offset 0, flags [DF], proto TCP (6), length 52)
    59.233.235.218.39247 > 59.233.235.223.nupaper-ss: Flags [.], cksum 0x1060 (correct), ack 4, win 115, options [nop,nop,TS val 18592804 ecr 46280426], length 0
07:23:12.303842 IP (tos 0x10, ttl 64, id 41188, offset 0, flags [DF], proto TCP (6), length 55)
    59.233.235.218.39247 > 59.233.235.223.nupaper-ss: Flags [P.], cksum 0xeb57 (correct), seq 1:4, ack 4, win 115, options [nop,nop,TS val 18592804 ecr 46280426], length 3
07:23:12.303962 IP (tos 0x0, ttl 64, id 54436, offset 0, flags [DF], proto TCP (6), length 52)
    59.233.235.223.nupaper-ss > 59.233.235.218.39247: Flags [.], cksum 0x0f0b (correct), ack 4, win 453, options [nop,nop,TS val 46280426 ecr 18592804], length 0
07:23:12.304147 IP (tos 0x0, ttl 64, id 54437, offset 0, flags [DF], proto TCP (6), length 70)
    59.233.235.223.nupaper-ss > 59.233.235.218.39247: Flags [P.], cksum 0xa799 (correct), seq 4:22, ack 4, win 453, options [nop,nop,TS val 46280426 ecr 18592804], length 18
07:23:12.304264 IP (tos 0x10, ttl 64, id 41189, offset 0, flags [DF], proto TCP (6), length 70)
    59.233.235.218.39247 > 59.233.235.223.nupaper-ss: Flags [P.], cksum 0xadda (correct), seq 4:22, ack 22, win 115, options [nop,nop,TS val 18592804 ecr 46280426], length 18
07:23:12.304425 IP (tos 0x0, ttl 64, id 54438, offset 0, flags [DF], proto TCP (6), length 76)
    59.233.235.223.nupaper-ss > 59.233.235.218.39247: Flags [P.], cksum 0x8d12 (correct), seq 22:46, ack 22, win 453, options [nop,nop,TS val 46280426 ecr 18592804], length 24
07:23:12.304605 IP (tos 0x10, ttl 64, id 41190, offset 0, flags [DF], proto TCP (6), length 119)
    59.233.235.218.39247 > 59.233.235.223.nupaper-ss: Flags [P.], cksum 0xa48b (correct), seq 22:89, ack 46, win 115, options [nop,nop,TS val 18592804 ecr 46280426], length 67
07:23:12.306736 IP (tos 0x0, ttl 64, id 54439, offset 0, flags [DF], proto TCP (6), length 70)
    59.233.235.223.nupaper-ss > 59.233.235.218.39247: Flags [P.], cksum 0xea39 (correct), seq 46:64, ack 89, win 453, options [nop,nop,TS val 46280427 ecr 18592804], length 18
07:23:12.306958 IP (tos 0x10, ttl 64, id 41191, offset 0, flags [DF], proto TCP (6), length 126)
    59.233.235.218.39247 > 59.233.235.223.nupaper-ss: Flags [P.], cksum 0x4553 (correct), seq 89:163, ack 64, win 115, options [nop,nop,TS val 18592804 ecr 46280427], length 74
07:23:12.307270 IP (tos 0x0, ttl 64, id 54440, offset 0, flags [DF], proto TCP (6), length 59)
    59.233.235.223.nupaper-ss > 59.233.235.218.39247: Flags [P.], cksum 0xf823 (correct), seq 64:71, ack 163, win 453, options [nop,nop,TS val 46280427 ecr 18592804], length 7
07:23:12.307408 IP (tos 0x10, ttl 64, id 41192, offset 0, flags [DF], proto TCP (6), length 59)
    59.233.235.218.39247 > 59.233.235.223.nupaper-ss: Flags [P.], cksum 0xf56e (correct), seq 163:170, ack 71, win 115, options [nop,nop,TS val 18592804 ecr 46280427], length 7
07:23:12.307704 IP (tos 0x0, ttl 64, id 54441, offset 0, flags [DF], proto TCP (6), length 67)
    59.233.235.223.nupaper-ss > 59.233.235.218.39247: Flags [P.], cksum 0xcc1f (correct), seq 71:86, ack 170, win 453, options [nop,nop,TS val 46280427 ecr 18592804], length 15
07:23:12.307843 IP (tos 0x10, ttl 64, id 41193, offset 0, flags [DF], proto TCP (6), length 61)
    59.233.235.218.39247 > 59.233.235.223.nupaper-ss: Flags [P.], cksum 0xf057 (correct), seq 170:179, ack 86, win 115, options [nop,nop,TS val 18592804 ecr 46280427], length 9
07:23:12.308016 IP (tos 0x0, ttl 64, id 54442, offset 0, flags [DF], proto TCP (6), length 93)
    59.233.235.223.nupaper-ss > 59.233.235.218.39247: Flags [P.], cksum 0x5b61 (correct), seq 86:127, ack 179, win 453, options [nop,nop,TS val 46280427 ecr 18592804], length 41
07:23:12.339309 IP (tos 0x10, ttl 64, id 41194, offset 0, flags [DF], proto TCP (6), length 52)
    59.233.235.218.39247 > 59.233.235.223.nupaper-ss: Flags [.], cksum 0x0f2e (correct), ack 127, win 115, options [nop,nop,TS val 18592808 ecr 46280427], length 0
07:23:12.339391 IP (tos 0x0, ttl 64, id 54443, offset 0, flags [DF], proto TCP (6), length 127)
    59.233.235.223.nupaper-ss > 59.233.235.218.39247: Flags [P.], cksum 0x4b8d (correct), seq 127:202, ack 179, win 453, options [nop,nop,TS val 46280435 ecr 18592808], length 75
07:23:12.339542 IP (tos 0x10, ttl 64, id 41195, offset 0, flags [DF], proto TCP (6), length 52)
    59.233.235.218.39247 > 59.233.235.223.nupaper-ss: Flags [.], cksum 0x0edb (correct), ack 202, win 115, options [nop,nop,TS val 18592808 ecr 46280435], length 0
07:23:24.491452 IP (tos 0x10, ttl 64, id 41196, offset 0, flags [DF], proto TCP (6), length 53)
    59.233.235.218.39247 > 59.233.235.223.nupaper-ss: Flags [P.], cksum 0x9e12 (correct), seq 179:180, ack 202, win 115, options [nop,nop,TS val 18594023 ecr 46280435], length 1
07:23:24.496998 IP (tos 0x0, ttl 64, id 54444, offset 0, flags [DF], proto TCP (6), length 54)
    59.233.235.223.nupaper-ss > 59.233.235.218.39247: Flags [P.], cksum 0xfc72 (correct), seq 202:204, ack 180, win 453, options [nop,nop,TS val 46283475 ecr 18594023], length 2
07:23:24.497158 IP (tos 0x10, ttl 64, id 41197, offset 0, flags [DF], proto TCP (6), length 52)
    59.233.235.218.39247 > 59.233.235.223.nupaper-ss: Flags [.], cksum 0xfe38 (correct), ack 204, win 115, options [nop,nop,TS val 18594023 ecr 46283475], length 0
07:23:24.591456 IP (tos 0x10, ttl 64, id 41198, offset 0, flags [DF], proto TCP (6), length 53)
    59.233.235.218.39247 > 59.233.235.223.nupaper-ss: Flags [P.], cksum 0x9925 (correct), seq 180:181, ack 204, win 115, options [nop,nop,TS val 18594033 ecr 46283475], length 1
07:23:24.597002 IP (tos 0x0, ttl 64, id 54445, offset 0, flags [DF], proto TCP (6), length 54)
    59.233.235.223.nupaper-ss > 59.233.235.218.39247: Flags [P.], cksum 0xfc53 (correct), seq 204:206, ack 181, win 453, options [nop,nop,TS val 46283500 ecr 18594033], length 2
07:23:24.597220 IP (tos 0x10, ttl 64, id 41199, offset 0, flags [DF], proto TCP (6), length 52)
    59.233.235.218.39247 > 59.233.235.223.nupaper-ss: Flags [.], cksum 0xfe12 (correct), ack 206, win 115, options [nop,nop,TS val 18594033 ecr 46283500], length 0
07:23:24.821113 IP (tos 0x10, ttl 64, id 41200, offset 0, flags [DF], proto TCP (6), length 53)
    59.233.235.218.39247 > 59.233.235.223.nupaper-ss: Flags [P.], cksum 0x87f2 (correct), seq 181:182, ack 206, win 115, options [nop,nop,TS val 18594056 ecr 46283500], length 1
07:23:24.828963 IP (tos 0x0, ttl 64, id 54446, offset 0, flags [DF], proto TCP (6), length 54)
    59.233.235.223.nupaper-ss > 59.233.235.218.39247: Flags [P.], cksum 0xfbee (correct), seq 206:208, ack 182, win 453, options [nop,nop,TS val 46283558 ecr 18594056], length 2
07:23:24.829099 IP (tos 0x10, ttl 64, id 41201, offset 0, flags [DF], proto TCP (6), length 52)
    59.233.235.218.39247 > 59.233.235.223.nupaper-ss: Flags [.], cksum 0xfdbe (correct), ack 208, win 115, options [nop,nop,TS val 18594056 ecr 46283558], length 0
07:23:24.911733 IP (tos 0x10, ttl 64, id 41202, offset 0, flags [DF], proto TCP (6), length 53)
    59.233.235.218.39247 > 59.233.235.223.nupaper-ss: Flags [P.], cksum 0x98ac (correct), seq 182:183, ack 208, win 115, options [nop,nop,TS val 18594065 ecr 46283558], length 1
07:23:24.916960 IP (tos 0x0, ttl 64, id 54447, offset 0, flags [DF], proto TCP (6), length 54)
    59.233.235.223.nupaper-ss > 59.233.235.218.39247: Flags [P.], cksum 0xfbdd (correct), seq 208:210, ack 183, win 453, options [nop,nop,TS val 46283580 ecr 18594065], length 2
07:23:24.917093 IP (tos 0x10, ttl 64, id 41203, offset 0, flags [DF], proto TCP (6), length 52)
    59.233.235.218.39247 > 59.233.235.223.nupaper-ss: Flags [.], cksum 0xfd9c (correct), ack 210, win 115, options [nop,nop,TS val 18594065 ecr 46283580], length 0
07:23:24.981645 IP (tos 0x10, ttl 64, id 41204, offset 0, flags [DF], proto TCP (6), length 53)
    59.233.235.218.39247 > 59.233.235.223.nupaper-ss: Flags [P.], cksum 0x918c (correct), seq 183:184, ack 210, win 115, options [nop,nop,TS val 18594072 ecr 46283580], length 1
07:23:24.988957 IP (tos 0x0, ttl 64, id 54448, offset 0, flags [DF], proto TCP (6), length 54)
    59.233.235.223.nupaper-ss > 59.233.235.218.39247: Flags [P.], cksum 0xfbba (correct), seq 210:212, ack 184, win 453, options [nop,nop,TS val 46283598 ecr 18594072], length 2
07:23:24.989096 IP (tos 0x10, ttl 64, id 41205, offset 0, flags [DF], proto TCP (6), length 52)
    59.233.235.218.39247 > 59.233.235.223.nupaper-ss: Flags [.], cksum 0xfd80 (correct), ack 212, win 115, options [nop,nop,TS val 18594072 ecr 46283598], length 0
07:23:25.311494 IP (tos 0x10, ttl 64, id 41206, offset 0, flags [DF], proto TCP (6), length 53)
    59.233.235.218.39247 > 59.233.235.223.nupaper-ss: Flags [P.], cksum 0xa556 (correct), seq 184:185, ack 212, win 115, options [nop,nop,TS val 18594105 ecr 46283598], length 1
07:23:25.317086 IP (tos 0x0, ttl 64, id 54449, offset 0, flags [DF], proto TCP (6), length 54)
    59.233.235.223.nupaper-ss > 59.233.235.218.39247: Flags [P.], cksum 0xfb58 (correct), seq 212:214, ack 185, win 453, options [nop,nop,TS val 46283680 ecr 18594105], length 2
07:23:25.317328 IP (tos 0x10, ttl 64, id 41207, offset 0, flags [DF], proto TCP (6), length 52)
    59.233.235.218.39247 > 59.233.235.223.nupaper-ss: Flags [.], cksum 0xfd0a (correct), ack 214, win 115, options [nop,nop,TS val 18594105 ecr 46283680], length 0
07:23:26.091422 IP (tos 0x10, ttl 64, id 41208, offset 0, flags [DF], proto TCP (6), length 53)
    59.233.235.218.39247 > 59.233.235.223.nupaper-ss: Flags [P.], cksum 0xefb3 (correct), seq 185:186, ack 214, win 115, options [nop,nop,TS val 18594183 ecr 46283680], length 1
07:23:26.094869 IP (tos 0x0, ttl 64, id 54450, offset 0, flags [DF], proto TCP (6), length 53)
    59.233.235.223.nupaper-ss > 59.233.235.218.39247: Flags [P.], cksum 0xf99e (correct), seq 214:215, ack 186, win 453, options [nop,nop,TS val 46283874 ecr 18594183], length 1
07:23:26.095123 IP (tos 0x10, ttl 64, id 41209, offset 0, flags [DF], proto TCP (6), length 52)
    59.233.235.218.39247 > 59.233.235.223.nupaper-ss: Flags [.], cksum 0xfbf8 (correct), ack 215, win 115, options [nop,nop,TS val 18594183 ecr 46283874], length 0
07:23:26.095219 IP (tos 0x0, ttl 64, id 54451, offset 0, flags [DF], proto TCP (6), length 65)
    59.233.235.223.nupaper-ss > 59.233.235.218.39247: Flags [P.], cksum 0x279d (correct), seq 215:228, ack 186, win 453, options [nop,nop,TS val 46283874 ecr 18594183], length 13
07:23:26.095329 IP (tos 0x10, ttl 64, id 41210, offset 0, flags [DF], proto TCP (6), length 52)
    59.233.235.218.39247 > 59.233.235.223.nupaper-ss: Flags [.], cksum 0xfbeb (correct), ack 228, win 115, options [nop,nop,TS val 18594183 ecr 46283874], length 0
07:23:34.363418 IP (tos 0x10, ttl 64, id 41211, offset 0, flags [DF], proto TCP (6), length 53)
    59.233.235.218.39247 > 59.233.235.223.nupaper-ss: Flags [P.], cksum 0x92a7 (correct), seq 186:187, ack 228, win 115, options [nop,nop,TS val 18595010 ecr 46283874], length 1
07:23:34.400964 IP (tos 0x0, ttl 64, id 54452, offset 0, flags [DF], proto TCP (6), length 52)
    59.233.235.223.nupaper-ss > 59.233.235.218.39247: Flags [.], cksum 0xef40 (correct), ack 187, win 453, options [nop,nop,TS val 46285951 ecr 18595010], length 0
07:23:35.253053 IP (tos 0x10, ttl 64, id 41212, offset 0, flags [DF], proto TCP (6), length 53)
    59.233.235.218.39247 > 59.233.235.223.nupaper-ss: Flags [P.], cksum 0x7c30 (correct), seq 187:188, ack 228, win 115, options [nop,nop,TS val 18595099 ecr 46285951], length 1
07:23:35.253134 IP (tos 0x0, ttl 64, id 54453, offset 0, flags [DF], proto TCP (6), length 52)
    59.233.235.223.nupaper-ss > 59.233.235.218.39247: Flags [.], cksum 0xee11 (correct), ack 188, win 453, options [nop,nop,TS val 46286164 ecr 18595099], length 0
07:23:35.873401 IP (tos 0x10, ttl 64, id 41213, offset 0, flags [DF], proto TCP (6), length 53)
    59.233.235.218.39247 > 59.233.235.223.nupaper-ss: Flags [P.], cksum 0x901c (correct), seq 188:189, ack 228, win 115, options [nop,nop,TS val 18595161 ecr 46286164], length 1
07:23:35.873472 IP (tos 0x0, ttl 64, id 54454, offset 0, flags [DF], proto TCP (6), length 52)
    59.233.235.223.nupaper-ss > 59.233.235.218.39247: Flags [.], cksum 0xed37 (correct), ack 189, win 453, options [nop,nop,TS val 46286319 ecr 18595161], length 0
07:23:36.343811 IP (tos 0x10, ttl 64, id 41214, offset 0, flags [DF], proto TCP (6), length 53)
    59.233.235.218.39247 > 59.233.235.223.nupaper-ss: Flags [P.], cksum 0x7751 (correct), seq 189:190, ack 228, win 115, options [nop,nop,TS val 18595208 ecr 46286319], length 1
07:23:36.343888 IP (tos 0x0, ttl 64, id 54455, offset 0, flags [DF], proto TCP (6), length 52)
    59.233.235.223.nupaper-ss > 59.233.235.218.39247: Flags [.], cksum 0xec92 (correct), ack 190, win 453, options [nop,nop,TS val 46286436 ecr 18595208], length 0
07:23:36.573585 IP (tos 0x10, ttl 64, id 41215, offset 0, flags [DF], proto TCP (6), length 53)
    59.233.235.218.39247 > 59.233.235.223.nupaper-ss: Flags [P.], cksum 0x8cc4 (correct), seq 190:191, ack 228, win 115, options [nop,nop,TS val 18595231 ecr 46286436], length 1
07:23:36.573646 IP (tos 0x0, ttl 64, id 54456, offset 0, flags [DF], proto TCP (6), length 52)
    59.233.235.223.nupaper-ss > 59.233.235.218.39247: Flags [.], cksum 0xec40 (correct), ack 191, win 453, options [nop,nop,TS val 46286494 ecr 18595231], length 0
07:23:36.803330 IP (tos 0x10, ttl 64, id 41216, offset 0, flags [DF], proto TCP (6), length 53)
    59.233.235.218.39247 > 59.233.235.223.nupaper-ss: Flags [P.], cksum 0x7f72 (correct), seq 191:192, ack 228, win 115, options [nop,nop,TS val 18595254 ecr 46286494], length 1
07:23:36.803391 IP (tos 0x0, ttl 64, id 54457, offset 0, flags [DF], proto TCP (6), length 52)
    59.233.235.223.nupaper-ss > 59.233.235.218.39247: Flags [.], cksum 0xebef (correct), ack 192, win 453, options [nop,nop,TS val 46286551 ecr 18595254], length 0
07:23:36.943261 IP (tos 0x10, ttl 64, id 41217, offset 0, flags [DF], proto TCP (6), length 53)
    59.233.235.218.39247 > 59.233.235.223.nupaper-ss: Flags [P.], cksum 0x892a (correct), seq 192:193, ack 228, win 115, options [nop,nop,TS val 18595268 ecr 46286551], length 1
07:23:36.943318 IP (tos 0x0, ttl 64, id 54458, offset 0, flags [DF], proto TCP (6), length 52)
    59.233.235.223.nupaper-ss > 59.233.235.218.39247: Flags [.], cksum 0xebbd (correct), ack 193, win 453, options [nop,nop,TS val 46286586 ecr 18595268], length 0
07:23:37.283708 IP (tos 0x10, ttl 64, id 41218, offset 0, flags [DF], proto TCP (6), length 53)
    59.233.235.218.39247 > 59.233.235.223.nupaper-ss: Flags [P.], cksum 0x7ae4 (correct), seq 193:194, ack 228, win 115, options [nop,nop,TS val 18595302 ecr 46286586], length 1
07:23:37.283783 IP (tos 0x0, ttl 64, id 54459, offset 0, flags [DF], proto TCP (6), length 52)
    59.233.235.223.nupaper-ss > 59.233.235.218.39247: Flags [.], cksum 0xeb45 (correct), ack 194, win 453, options [nop,nop,TS val 46286671 ecr 18595302], length 0
07:23:38.864101 IP (tos 0x10, ttl 64, id 41219, offset 0, flags [DF], proto TCP (6), length 53)
    59.233.235.218.39247 > 59.233.235.223.nupaper-ss: Flags [P.], cksum 0x6cf0 (correct), seq 194:195, ack 228, win 115, options [nop,nop,TS val 18595460 ecr 46286671], length 1
07:23:38.864181 IP (tos 0x0, ttl 64, id 54460, offset 0, flags [DF], proto TCP (6), length 52)
    59.233.235.223.nupaper-ss > 59.233.235.218.39247: Flags [.], cksum 0xe91b (correct), ack 195, win 453, options [nop,nop,TS val 46287066 ecr 18595460], length 0
07:23:39.233935 IP (tos 0x10, ttl 64, id 41220, offset 0, flags [DF], proto TCP (6), length 53)
    59.233.235.218.39247 > 59.233.235.223.nupaper-ss: Flags [P.], cksum 0x6b3f (correct), seq 195:196, ack 228, win 115, options [nop,nop,TS val 18595497 ecr 46287066], length 1
07:23:39.234016 IP (tos 0x0, ttl 64, id 54461, offset 0, flags [DF], proto TCP (6), length 52)
    59.233.235.223.nupaper-ss > 59.233.235.218.39247: Flags [.], cksum 0xe898 (correct), ack 196, win 453, options [nop,nop,TS val 46287159 ecr 18595497], length 0
07:23:39.604364 IP (tos 0x10, ttl 64, id 41221, offset 0, flags [DF], proto TCP (6), length 53)
    59.233.235.218.39247 > 59.233.235.223.nupaper-ss: Flags [P.], cksum 0x6abc (correct), seq 196:197, ack 228, win 115, options [nop,nop,TS val 18595534 ecr 46287159], length 1
07:23:39.604414 IP (tos 0x0, ttl 64, id 54462, offset 0, flags [DF], proto TCP (6), length 52)
    59.233.235.223.nupaper-ss > 59.233.235.218.39247: Flags [.], cksum 0xe816 (correct), ack 197, win 453, options [nop,nop,TS val 46287251 ecr 18595534], length 0
07:23:40.374542 IP (tos 0x10, ttl 64, id 41222, offset 0, flags [DF], proto TCP (6), length 53)
    59.233.235.218.39247 > 59.233.235.223.nupaper-ss: Flags [P.], cksum 0x9b12 (correct), seq 197:198, ack 228, win 115, options [nop,nop,TS val 18595611 ecr 46287251], length 1
07:23:40.374620 IP (tos 0x0, ttl 64, id 54463, offset 0, flags [DF], proto TCP (6), length 52)
    59.233.235.223.nupaper-ss > 59.233.235.218.39247: Flags [.], cksum 0xe707 (correct), ack 198, win 453, options [nop,nop,TS val 46287444 ecr 18595611], length 0
07:23:40.574439 IP (tos 0x10, ttl 64, id 41223, offset 0, flags [DF], proto TCP (6), length 53)
    59.233.235.218.39247 > 59.233.235.223.nupaper-ss: Flags [P.], cksum 0xa43c (correct), seq 198:199, ack 228, win 115, options [nop,nop,TS val 18595631 ecr 46287444], length 1
07:23:40.574508 IP (tos 0x0, ttl 64, id 54464, offset 0, flags [DF], proto TCP (6), length 52)
    59.233.235.223.nupaper-ss > 59.233.235.218.39247: Flags [.], cksum 0xe6c0 (correct), ack 199, win 453, options [nop,nop,TS val 46287494 ecr 18595631], length 0
07:23:42.264451 IP (tos 0x10, ttl 64, id 41224, offset 0, flags [DF], proto TCP (6), length 53)
    59.233.235.218.39247 > 59.233.235.223.nupaper-ss: Flags [P.], cksum 0x9560 (correct), seq 199:200, ack 228, win 115, options [nop,nop,TS val 18595800 ecr 46287494], length 1
07:23:42.264529 IP (tos 0x0, ttl 64, id 54465, offset 0, flags [DF], proto TCP (6), length 52)
    59.233.235.223.nupaper-ss > 59.233.235.218.39247: Flags [.], cksum 0xe470 (correct), ack 200, win 453, options [nop,nop,TS val 46287916 ecr 18595800], length 0
07:23:43.574954 IP (tos 0x10, ttl 64, id 41225, offset 0, flags [DF], proto TCP (6), length 53)
    59.233.235.218.39247 > 59.233.235.223.nupaper-ss: Flags [P.], cksum 0x8036 (correct), seq 200:201, ack 228, win 115, options [nop,nop,TS val 18595931 ecr 46287916], length 1
07:23:43.575036 IP (tos 0x0, ttl 64, id 54466, offset 0, flags [DF], proto TCP (6), length 52)
    59.233.235.223.nupaper-ss > 59.233.235.218.39247: Flags [.], cksum 0xe2a4 (correct), ack 201, win 453, options [nop,nop,TS val 46288244 ecr 18595931], length 0
07:23:44.014684 IP (tos 0x10, ttl 64, id 41226, offset 0, flags [DF], proto TCP (6), length 53)
    59.233.235.218.39247 > 59.233.235.223.nupaper-ss: Flags [P.], cksum 0x77c1 (correct), seq 201:202, ack 228, win 115, options [nop,nop,TS val 18595975 ecr 46288244], length 1
07:23:44.014742 IP (tos 0x0, ttl 64, id 54467, offset 0, flags [DF], proto TCP (6), length 52)
    59.233.235.223.nupaper-ss > 59.233.235.218.39247: Flags [.], cksum 0xe209 (correct), ack 202, win 453, options [nop,nop,TS val 46288354 ecr 18595975], length 0
07:23:44.635281 IP (tos 0x10, ttl 64, id 41227, offset 0, flags [DF], proto TCP (6), length 53)
    59.233.235.218.39247 > 59.233.235.223.nupaper-ss: Flags [P.], cksum 0x6414 (correct), seq 202:203, ack 228, win 115, options [nop,nop,TS val 18596037 ecr 46288354], length 1
07:23:44.635364 IP (tos 0x0, ttl 64, id 54468, offset 0, flags [DF], proto TCP (6), length 52)
    59.233.235.223.nupaper-ss > 59.233.235.218.39247: Flags [.], cksum 0xe12f (correct), ack 203, win 453, options [nop,nop,TS val 46288509 ecr 18596037], length 0
07:23:44.805020 IP (tos 0x10, ttl 64, id 41228, offset 0, flags [DF], proto TCP (6), length 53)
    59.233.235.218.39247 > 59.233.235.223.nupaper-ss: Flags [P.], cksum 0x9667 (correct), seq 203:204, ack 228, win 115, options [nop,nop,TS val 18596054 ecr 46288509], length 1
07:23:44.805072 IP (tos 0x0, ttl 64, id 54469, offset 0, flags [DF], proto TCP (6), length 52)
    59.233.235.223.nupaper-ss > 59.233.235.218.39247: Flags [.], cksum 0xe0f2 (correct), ack 204, win 453, options [nop,nop,TS val 46288552 ecr 18596054], length 0
07:23:45.074939 IP (tos 0x10, ttl 64, id 41229, offset 0, flags [DF], proto TCP (6), length 53)
    59.233.235.218.39247 > 59.233.235.223.nupaper-ss: Flags [P.], cksum 0xb220 (correct), seq 204:205, ack 228, win 115, options [nop,nop,TS val 18596081 ecr 46288552], length 1
07:23:45.074992 IP (tos 0x0, ttl 64, id 54470, offset 0, flags [DF], proto TCP (6), length 52)
    59.233.235.223.nupaper-ss > 59.233.235.218.39247: Flags [.], cksum 0xe093 (correct), ack 205, win 453, options [nop,nop,TS val 46288619 ecr 18596081], length 0
07:23:45.104894 IP (tos 0x10, ttl 64, id 41230, offset 0, flags [DF], proto TCP (6), length 53)
    59.233.235.218.39247 > 59.233.235.223.nupaper-ss: Flags [P.], cksum 0x95d9 (correct), seq 205:206, ack 228, win 115, options [nop,nop,TS val 18596084 ecr 46288619], length 1
07:23:45.104948 IP (tos 0x0, ttl 64, id 54471, offset 0, flags [DF], proto TCP (6), length 52)
    59.233.235.223.nupaper-ss > 59.233.235.218.39247: Flags [.], cksum 0xe088 (correct), ack 206, win 453, options [nop,nop,TS val 46288626 ecr 18596084], length 0
07:23:45.965233 IP (tos 0x10, ttl 64, id 41231, offset 0, flags [DF], proto TCP (6), length 53)
    59.233.235.218.39247 > 59.233.235.223.nupaper-ss: Flags [P.], cksum 0xd47b (correct), seq 206:207, ack 228, win 115, options [nop,nop,TS val 18596170 ecr 46288626], length 1
07:23:45.965310 IP (tos 0x0, ttl 64, id 54472, offset 0, flags [DF], proto TCP (6), length 52)
    59.233.235.223.nupaper-ss > 59.233.235.218.39247: Flags [.], cksum 0xdf59 (correct), ack 207, win 453, options [nop,nop,TS val 46288842 ecr 18596170], length 0
07:23:45.972986 IP (tos 0x0, ttl 64, id 54473, offset 0, flags [DF], proto TCP (6), length 55)
    59.233.235.223.nupaper-ss > 59.233.235.218.39247: Flags [P.], cksum 0xd53f (correct), seq 228:231, ack 207, win 453, options [nop,nop,TS val 46288844 ecr 18596170], length 3
07:23:45.973182 IP (tos 0x10, ttl 64, id 41232, offset 0, flags [DF], proto TCP (6), length 52)
    59.233.235.218.39247 > 59.233.235.223.nupaper-ss: Flags [.], cksum 0xe0a6 (correct), ack 231, win 115, options [nop,nop,TS val 18596170 ecr 46288844], length 0
07:23:48.730070 IP (tos 0x0, ttl 64, id 54474, offset 0, flags [DF], proto TCP (6), length 53)
    59.233.235.223.nupaper-ss > 59.233.235.218.39247: Flags [P.], cksum 0xdb9a (correct), seq 231:232, ack 207, win 453, options [nop,nop,TS val 46289533 ecr 18596170], length 1
07:23:48.730327 IP (tos 0x10, ttl 64, id 41233, offset 0, flags [DF], proto TCP (6), length 52)
    59.233.235.218.39247 > 59.233.235.223.nupaper-ss: Flags [.], cksum 0xdce0 (correct), ack 232, win 115, options [nop,nop,TS val 18596446 ecr 46289533], length 0
07:23:48.730424 IP (tos 0x0, ttl 64, id 54475, offset 0, flags [DF], proto TCP (6), length 87)
    59.233.235.223.nupaper-ss > 59.233.235.218.39247: Flags [P.], cksum 0xdd9c (correct), seq 232:267, ack 207, win 453, options [nop,nop,TS val 46289533 ecr 18596446], length 35
07:23:48.730579 IP (tos 0x10, ttl 64, id 41234, offset 0, flags [DF], proto TCP (6), length 52)
    59.233.235.218.39247 > 59.233.235.223.nupaper-ss: Flags [.], cksum 0xdcbd (correct), ack 267, win 115, options [nop,nop,TS val 18596446 ecr 46289533], length 0
07:23:54.377030 IP (tos 0x10, ttl 64, id 41235, offset 0, flags [DF], proto TCP (6), length 52)
    59.233.235.218.39247 > 59.233.235.223.nupaper-ss: Flags [F.], cksum 0xda87 (correct), seq 207, ack 267, win 115, options [nop,nop,TS val 18597011 ecr 46289533], length 0
07:23:54.377594 IP (tos 0x0, ttl 64, id 54476, offset 0, flags [DF], proto TCP (6), length 52)
    59.233.235.223.nupaper-ss > 59.233.235.218.39247: Flags [F.], cksum 0xd3b0 (correct), seq 267, ack 208, win 453, options [nop,nop,TS val 46290945 ecr 18597011], length 0
07:23:54.377802 IP (tos 0x10, ttl 64, id 41236, offset 0, flags [DF], proto TCP (6), length 52)
    59.233.235.218.39247 > 59.233.235.223.nupaper-ss: Flags [.], cksum 0xd502 (correct), ack 268, win 115, options [nop,nop,TS val 18597011 ecr 46290945], length 0
